{
  "rubric_id": "litmundi-literary-v1",
  "edition_id": "wilde-artist-vi-ai-draft-2026",
  "source_edition_id": "wilde-artist-en-methuen-1913",
  "reviewed_at": "2026-11-01",
  "kind": "ai_preflight",
  "reviewer": {
    "identifier": "litmundi-ai-editorial-preflight",
    "display_name": "AI-assisted translation and adversarial preflight (not a human reviewer)",
    "github_handle": null,
    "independent": false,
    "evidence_url": null
  },
  "source_sha256": "bd014887242c1b44ed98a4a9e1f8568494173d3fedb0ecf4fd9951c808fcf4ef",
  "target_sha256": "602d1533021aaf0fe2c3241a088a97b94a9e6147eefbf72dbe0c7d98b0da75fc",
  "segments_reviewed": [
    "wilde-the-artist:1.1",
    "wilde-the-artist:1.2",
    "wilde-the-artist:1.3",
    "wilde-the-artist:1.4",
    "wilde-the-artist:1.5"
  ],
  "scores": {
    "semantic_fidelity": 9,
    "literary_voice": 8,
    "target_naturalness": 8.5,
    "imagery_consistency": 8.5,
    "editorial_mechanics": 9
  },
  "findings": [
    {
      "segment": "wilde-the-artist:1.1",
      "category": "literary_voice",
      "severity": "minor",
      "status": "open",
      "explanation": "The elevated phrase Lạc Thú Chỉ Lưu Lại Một Khoảnh Khắc remains long and slightly unusual; compare aloud with the conservative earlier version before approval."
    },
    {
      "segment": "wilde-the-artist:1.3",
      "category": "target_naturalness",
      "severity": "minor",
      "status": "open",
      "explanation": "Điều đã chết preserves the unnamed referent but strains ordinary Vietnamese collocation. Compare thứ đã chết without turning the referent into a named person or gender."
    },
    {
      "segment": "wilde-the-artist:1.4",
      "category": "literary_voice",
      "severity": "minor",
      "status": "resolved",
      "explanation": "Replaced the rhetorical expansion phó nó cho ngọn lửa with trao nó cho lửa; this keeps the source’s simple, ritual giving and parallel And clauses."
    }
  ],
  "summary": "AI-assisted revision and adversarial preflight only, covering all five passages. Retained repeated bronze/world/image, restored paragraph-three And, removed editorial explanatory dashes, and rejected Chỉ Còn after detecting an added residual-time implication. The earlier historical 8.6 self-assessment is preserved. This revision is also provisionally 8.6: it improves specific defects without evidence that the unresolved allegorical cadence and unnamed dead thing now meet publication-grade Vietnamese. No human reviewer, identity, independence, license permission or approval is asserted."
}
