{
  "rubric_id": "litmundi-literary-v1",
  "edition_id": "pardo-encaje-vi-ai-draft-2026",
  "source_edition_id": "pardo-encaje-es-administracion-c1898",
  "reviewed_at": "2026-11-01",
  "kind": "ai_preflight",
  "reviewer": {
    "identifier": "litmundi-ai-editorial-preflight",
    "display_name": "AI-assisted translation and adversarial preflight (not a human reviewer)",
    "github_handle": null,
    "independent": false,
    "evidence_url": null
  },
  "source_sha256": "a3caa4cfea7ce7b9183e511a21de4ff81a53b31ac5ac289eaba036e8ce3f053e",
  "target_sha256": "400ff0ff139097327a9fb032cd3f02061a704a847cb26d8f8270f8acea17f1c8",
  "segments_reviewed": [
    "pardo-bazan-el-encaje-roto:1.1",
    "pardo-bazan-el-encaje-roto:1.2",
    "pardo-bazan-el-encaje-roto:1.3",
    "pardo-bazan-el-encaje-roto:1.4",
    "pardo-bazan-el-encaje-roto:1.5",
    "pardo-bazan-el-encaje-roto:1.6",
    "pardo-bazan-el-encaje-roto:1.7",
    "pardo-bazan-el-encaje-roto:1.8",
    "pardo-bazan-el-encaje-roto:1.9",
    "pardo-bazan-el-encaje-roto:1.10",
    "pardo-bazan-el-encaje-roto:1.11",
    "pardo-bazan-el-encaje-roto:1.12",
    "pardo-bazan-el-encaje-roto:1.13",
    "pardo-bazan-el-encaje-roto:1.14",
    "pardo-bazan-el-encaje-roto:1.15"
  ],
  "scores": {
    "semantic_fidelity": 8.5,
    "literary_voice": 8,
    "target_naturalness": 8.5,
    "imagery_consistency": 8.5,
    "editorial_mechanics": 9
  },
  "findings": [
    {
      "segment": "pardo-bazan-el-encaje-roto:1.1",
      "category": "semantic_fidelity",
      "severity": "major",
      "status": "resolved",
      "explanation": "The unquoted draft phrase tiếng không rõ ràng could mean an unclear sound. Quoting “không” throughout the refusal/vows restores the explicit and emphatic refusal."
    },
    {
      "segment": "pardo-bazan-el-encaje-roto:1.9",
      "category": "semantic_fidelity",
      "severity": "minor",
      "status": "resolved",
      "explanation": "The draft nóng nảy softened violento. Revised to tính khí hung bạo while avoiding the unsupported assertion of proven physical abuse."
    },
    {
      "segment": "pardo-bazan-el-encaje-roto:1.4",
      "category": "imagery_consistency",
      "severity": "minor",
      "status": "open",
      "explanation": "Roca antigua is rendered generally as antique precious stones; the exact historical jewelry sense and singular/collective force remain uncertain."
    },
    {
      "segment": "pardo-bazan-el-encaje-roto:1.8",
      "category": "literary_voice",
      "severity": "minor",
      "status": "open",
      "explanation": "The idiom un decir Jesús is rendered with both a time gloss and the religious utterance. A bilingual editor should decide whether this doubles the explanation and slows the conversational voice."
    },
    {
      "segment": "pardo-bazan-el-encaje-roto:1.3",
      "category": "target_naturalness",
      "severity": "minor",
      "status": "open",
      "explanation": "The long ceremony paragraph preserves the source’s accumulating clauses, but Vietnamese breath groups and social-register terms still require read-aloud literary revision."
    },
    {
      "segment": "pardo-bazan-el-encaje-roto:1.11",
      "category": "semantic_fidelity",
      "severity": "minor",
      "status": "resolved",
      "explanation": "No llegó á tanto describes an aborted insult; chưa adds a not-yet implication which the source does not establish. The recorded draft rendering was revised after an additional AI-assisted adversarial reading."
    },
    {
      "segment": "pardo-bazan-el-encaje-roto:1.12",
      "category": "semantic_fidelity",
      "severity": "minor",
      "status": "resolved",
      "explanation": "In this sequence dureza is harshness, not neutral or admirable firmness. The recorded draft rendering was revised after an additional AI-assisted adversarial reading."
    },
    {
      "segment": "pardo-bazan-el-encaje-roto:1.3",
      "category": "semantic_fidelity",
      "severity": "minor",
      "status": "resolved",
      "explanation": "Medio ambiente includes the social setting and constraints, not only the onlookers. The recorded draft rendering was revised after an additional AI-assisted adversarial reading."
    }
  ],
  "summary": "AI-assisted direct Spanish-to-Vietnamese draft and adversarial preflight only, covering all 15 historical paragraphs. The narration remains explicitly imagined until the later conversation; no modern diagnosis is added. Preflight fixed the dangerous unquoted không ambiguity and strengthened violento beyond mere irritability. The exact jewelry sense of roca antigua, the idiom un decir Jesús and the long social tableau remain open editorial questions. The provisional weighted score is 8.425 (reported 8.43), below the publication threshold; this is no human approval and supplies neither reviewer evidence nor an open-license grant. An additional AI-assisted read corrected 3 documented local fidelity issues without changing the advisory score."
}
